<?xml version="1.0" encoding="UTF-8"?>
<!DOCTYPE SnakeHunt SYSTEM "snakehunt.dtd">
<SnakeHunt>
    <Time unit="s">
        <Limit>10.0</Limit>
    </Time>
    <Jungle rows="11" cols="11" signs="ABCDEFGHIJKLMNOPQRSTUVWXYZ">
        <Field id="F0" row="0" col="0" usability="1" points="1">K</Field>
        <Field id="F1" row="0" col="1" usability="1" points="1">E</Field>
        <Field id="F2" row="0" col="2" usability="1" points="1">L</Field>
        <Field id="F3" row="0" col="3" usability="1" points="1">R</Field>
        <Field id="F4" row="0" col="4" usability="1" points="1">A</Field>
        <Field id="F5" row="0" col="5" usability="1" points="1">H</Field>
        <Field id="F6" row="0" col="6" usability="1" points="1">J</Field>
        <Field id="F7" row="0" col="7" usability="1" points="1">M</Field>
        <Field id="F8" row="0" col="8" usability="1" points="1">Y</Field>
        <Field id="F9" row="0" col="9" usability="1" points="1">U</Field>
        <Field id="F10" row="0" col="10" usability="1" points="1">S</Field>
        <Field id="F11" row="1" col="0" usability="1" points="1">T</Field>
        <Field id="F12" row="1" col="1" usability="1" points="1">E</Field>
        <Field id="F13" row="1" col="2" usability="1" points="1">T</Field>
        <Field id="F14" row="1" col="3" usability="1" points="1">W</Field>
        <Field id="F15" row="1" col="4" usability="1" points="1">W</Field>
        <Field id="F16" row="1" col="5" usability="1" points="1">T</Field>
        <Field id="F17" row="1" col="6" usability="1" points="1">A</Field>
        <Field id="F18" row="1" col="7" usability="1" points="1">H</Field>
        <Field id="F19" row="1" col="8" usability="1" points="1">S</Field>
        <Field id="F20" row="1" col="9" usability="1" points="1">E</Field>
        <Field id="F21" row="1" col="10" usability="1" points="1">E</Field>
        <Field id="F22" row="2" col="0" usability="1" points="1">K</Field>
        <Field id="F23" row="2" col="1" usability="1" points="1">R</Field>
        <Field id="F24" row="2" col="2" usability="1" points="1">S</Field>
        <Field id="F25" row="2" col="3" usability="1" points="1">R</Field>
        <Field id="F26" row="2" col="4" usability="1" points="1">R</Field>
        <Field id="F27" row="2" col="5" usability="1" points="1">F</Field>
        <Field id="F28" row="2" col="6" usability="1" points="1">I</Field>
        <Field id="F29" row="2" col="7" usability="1" points="1">C</Field>
        <Field id="F30" row="2" col="8" usability="1" points="1">L</Field>
        <Field id="F31" row="2" col="9" usability="1" points="1">L</Field>
        <Field id="F32" row="2" col="10" usability="1" points="1">G</Field>
        <Field id="F33" row="3" col="0" usability="1" points="1">X</Field>
        <Field id="F34" row="3" col="1" usability="1" points="1">I</Field>
        <Field id="F35" row="3" col="2" usability="1" points="1">Z</Field>
        <Field id="F36" row="3" col="3" usability="1" points="1">D</Field>
        <Field id="F37" row="3" col="4" usability="1" points="1">H</Field>
        <Field id="F38" row="3" col="5" usability="1" points="1">F</Field>
        <Field id="F39" row="3" col="6" usability="1" points="1">F</Field>
        <Field id="F40" row="3" col="7" usability="1" points="1">H</Field>
        <Field id="F41" row="3" col="8" usability="1" points="1">C</Field>
        <Field id="F42" row="3" col="9" usability="1" points="1">N</Field>
        <Field id="F43" row="3" col="10" usability="1" points="1">T</Field>
        <Field id="F44" row="4" col="0" usability="1" points="1">N</Field>
        <Field id="F45" row="4" col="1" usability="1" points="1">F</Field>
        <Field id="F46" row="4" col="2" usability="1" points="1">I</Field>
        <Field id="F47" row="4" col="3" usability="1" points="1">O</Field>
        <Field id="F48" row="4" col="4" usability="1" points="1">A</Field>
        <Field id="F49" row="4" col="5" usability="1" points="1">M</Field>
        <Field id="F50" row="4" col="6" usability="1" points="1">F</Field>
        <Field id="F51" row="4" col="7" usability="1" points="1">S</Field>
        <Field id="F52" row="4" col="8" usability="1" points="1">Q</Field>
        <Field id="F53" row="4" col="9" usability="1" points="1">M</Field>
        <Field id="F54" row="4" col="10" usability="1" points="1">E</Field>
        <Field id="F55" row="5" col="0" usability="1" points="1">G</Field>
        <Field id="F56" row="5" col="1" usability="1" points="1">E</Field>
        <Field id="F57" row="5" col="2" usability="1" points="1">T</Field>
        <Field id="F58" row="5" col="3" usability="1" points="1">E</Field>
        <Field id="F59" row="5" col="4" usability="1" points="1">N</Field>
        <Field id="F60" row="5" col="5" usability="1" points="1">E</Field>
        <Field id="F61" row="5" col="6" usability="1" points="1">P</Field>
        <Field id="F62" row="5" col="7" usability="1" points="1">F</Field>
        <Field id="F63" row="5" col="8" usability="1" points="1">B</Field>
        <Field id="F64" row="5" col="9" usability="1" points="1">E</Field>
        <Field id="F65" row="5" col="10" usability="1" points="1">A</Field>
        <Field id="F66" row="6" col="0" usability="1" points="1">T</Field>
        <Field id="F67" row="6" col="1" usability="1" points="1">Ä</Field>
        <Field id="F68" row="6" col="2" usability="1" points="1">N</Field>
        <Field id="F69" row="6" col="3" usability="1" points="1">A</Field>
        <Field id="F70" row="6" col="4" usability="1" points="1">D</Field>
        <Field id="F71" row="6" col="5" usability="1" points="1">A</Field>
        <Field id="F72" row="6" col="6" usability="1" points="1">M</Field>
        <Field id="F73" row="6" col="7" usability="1" points="1">O</Field>
        <Field id="F74" row="6" col="8" usability="1" points="1">A</Field>
        <Field id="F75" row="6" col="9" usability="1" points="1">T</Field>
        <Field id="F76" row="6" col="10" usability="1" points="1">E</Field>
        <Field id="F77" row="7" col="0" usability="1" points="1">P</Field>
        <Field id="F78" row="7" col="1" usability="1" points="1">E</Field>
        <Field id="F79" row="7" col="2" usability="1" points="1">Z</Field>
        <Field id="F80" row="7" col="3" usability="1" points="1">H</Field>
        <Field id="F81" row="7" col="4" usability="1" points="1">U</Field>
        <Field id="F82" row="7" col="5" usability="1" points="1">I</Field>
        <Field id="F83" row="7" col="6" usability="1" points="1">E</Field>
        <Field id="F84" row="7" col="7" usability="1" points="1">S</Field>
        <Field id="F85" row="7" col="8" usability="1" points="1">E</Field>
        <Field id="F86" row="7" col="9" usability="1" points="1">B</Field>
        <Field id="F87" row="7" col="10" usability="1" points="1">N</Field>
        <Field id="F88" row="8" col="0" usability="1" points="1">D</Field>
        <Field id="F89" row="8" col="1" usability="1" points="1">Z</Field>
        <Field id="F90" row="8" col="2" usability="1" points="1">S</Field>
        <Field id="F91" row="8" col="3" usability="1" points="1">A</Field>
        <Field id="F92" row="8" col="4" usability="1" points="1">R</Field>
        <Field id="F93" row="8" col="5" usability="1" points="1">B</Field>
        <Field id="F94" row="8" col="6" usability="1" points="1">P</Field>
        <Field id="F95" row="8" col="7" usability="1" points="1">M</Field>
        <Field id="F96" row="8" col="8" usability="1" points="1">R</Field>
        <Field id="F97" row="8" col="9" usability="1" points="1">U</Field>
        <Field id="F98" row="8" col="10" usability="1" points="1">U</Field>
        <Field id="F99" row="9" col="0" usability="1" points="1">Q</Field>
        <Field id="F100" row="9" col="1" usability="1" points="1">C</Field>
        <Field id="F101" row="9" col="2" usability="1" points="1">U</Field>
        <Field id="F102" row="9" col="3" usability="1" points="1">X</Field>
        <Field id="F103" row="9" col="4" usability="1" points="1">J</Field>
        <Field id="F104" row="9" col="5" usability="1" points="1">T</Field>
        <Field id="F105" row="9" col="6" usability="1" points="1">S</Field>
        <Field id="F106" row="9" col="7" usability="1" points="1">E</Field>
        <Field id="F107" row="9" col="8" usability="1" points="1">K</Field>
        <Field id="F108" row="9" col="9" usability="1" points="1">T</Field>
        <Field id="F109" row="9" col="10" usability="1" points="1">A</Field>
        <Field id="F110" row="10" col="0" usability="1" points="1">G</Field>
        <Field id="F111" row="10" col="1" usability="1" points="1">D</Field>
        <Field id="F112" row="10" col="2" usability="1" points="1">Y</Field>
        <Field id="F113" row="10" col="3" usability="1" points="1">P</Field>
        <Field id="F114" row="10" col="4" usability="1" points="1">T</Field>
        <Field id="F115" row="10" col="5" usability="1" points="1">B</Field>
        <Field id="F116" row="10" col="6" usability="1" points="1">E</Field>
        <Field id="F117" row="10" col="7" usability="1" points="1">W</Field>
        <Field id="F118" row="10" col="8" usability="1" points="1">R</Field>
        <Field id="F119" row="10" col="9" usability="1" points="1">B</Field>
        <Field id="F120" row="10" col="10" usability="1" points="1">X</Field>
    </Jungle>
    <SnakeTypes>
        <SnakeType id="A0" points="1" amount="1">
            <Word>DONAUDAMPFSCHIFFFAHRTSELEKTRIZITÄTENHAUPTBETRIEBSWERKBAUUNTERBEAMTENGESELLSCHAFT</Word>
            <NeighborhoodStructure type="Distance">
                <Parameter value="1" />
            </NeighborhoodStructure>
        </SnakeType>
    </SnakeTypes>
</SnakeHunt>
