<?xml version="1.0" encoding="UTF-8"?>
<!DOCTYPE SnakeHunt SYSTEM "snakehunt.dtd">
<SnakeHunt>
    <Time unit="s">
        <Limit>10.0</Limit>
    </Time>
    <Jungle rows="5" cols="8" signs="ABCDEFGHIJKLMNOPQRSTUVWXYZ">
        <Field id="F0" row="0" col="0" usability="1" points="1">N</Field>
        <Field id="F1" row="0" col="1" usability="1" points="1">G</Field>
        <Field id="F2" row="0" col="2" usability="1" points="1">R</Field>
        <Field id="F3" row="0" col="3" usability="1" points="1">N</Field>
        <Field id="F4" row="0" col="4" usability="1" points="1">T</Field>
        <Field id="F5" row="0" col="5" usability="1" points="1">A</Field>
        <Field id="F6" row="0" col="6" usability="1" points="1">R</Field>
        <Field id="F7" row="0" col="7" usability="1" points="1">E</Field>
        <Field id="F8" row="1" col="0" usability="1" points="1">H</Field>
        <Field id="F9" row="1" col="1" usability="1" points="1">I</Field>
        <Field id="F10" row="1" col="2" usability="1" points="1">E</Field>
        <Field id="F11" row="1" col="3" usability="1" points="1">I</Field>
        <Field id="F12" row="1" col="4" usability="1" points="1">T</Field>
        <Field id="F13" row="1" col="5" usability="1" points="1">A</Field>
        <Field id="F14" row="1" col="6" usability="1" points="1">T</Field>
        <Field id="F15" row="1" col="7" usability="1" points="1">Ä</Field>
        <Field id="F16" row="2" col="0" usability="1" points="1">C</Field>
        <Field id="F17" row="2" col="1" usability="1" points="1">R</Field>
        <Field id="F18" row="2" col="2" usability="1" points="1">N</Field>
        <Field id="F19" row="2" col="3" usability="1" points="1">N</Field>
        <Field id="F20" row="2" col="4" usability="1" points="1">E</Field>
        <Field id="F21" row="2" col="5" usability="1" points="1">N</Field>
        <Field id="F22" row="2" col="6" usability="1" points="1">S</Field>
        <Field id="F23" row="2" col="7" usability="1" points="1">T</Field>
        <Field id="F24" row="3" col="0" usability="1" points="1">G</Field>
        <Field id="F25" row="3" col="1" usability="1" points="1">R</Field>
        <Field id="F26" row="3" col="2" usability="1" points="1">L</Field>
        <Field id="F27" row="3" col="3" usability="1" points="1">P</Field>
        <Field id="F28" row="3" col="4" usability="1" points="1">T</Field>
        <Field id="F29" row="3" col="5" usability="1" points="1">L</Field>
        <Field id="F30" row="3" col="6" usability="1" points="1">K</Field>
        <Field id="F31" row="3" col="7" usability="1" points="1">U</Field>
        <Field id="F32" row="4" col="0" usability="1" points="1">E</Field>
        <Field id="F33" row="4" col="1" usability="1" points="1">L</Field>
        <Field id="F34" row="4" col="2" usability="1" points="1">S</Field>
        <Field id="F35" row="4" col="3" usability="1" points="1">A</Field>
        <Field id="F36" row="4" col="4" usability="1" points="1">R</Field>
        <Field id="F37" row="4" col="5" usability="1" points="1">A</Field>
        <Field id="F38" row="4" col="6" usability="1" points="1">T</Field>
        <Field id="F39" row="4" col="7" usability="1" points="1">A</Field>
    </Jungle>
    <SnakeTypes>
        <SnakeType id="A0" points="1" amount="1">
            <Word>ÄSKULAPNATTER</Word>
            <NeighborhoodStructure type="Distance">
                <Parameter value="2" />
            </NeighborhoodStructure>
        </SnakeType>
        <SnakeType id="A1" points="1" amount="1">
            <Word>RINGELNATTER</Word>
            <NeighborhoodStructure type="Distance">
                <Parameter value="2" />
            </NeighborhoodStructure>
        </SnakeType>
        <SnakeType id="A2" points="1" amount="1">
            <Word>SCHLINGNATTER</Word>
            <NeighborhoodStructure type="Distance">
                <Parameter value="2" />
            </NeighborhoodStructure>
        </SnakeType>
    </SnakeTypes>
</SnakeHunt>
